Score,Title,Subreddit,Author,Upvotes,Comments,URL,Content
4,I need Help,r/DigitalMarketingHelp,danitwelve91,2,6,https://www.reddit.com/r/DigitalMarketingHelp/comments/1ih8z95/i_need_help/,"I am a web design and photography who is trying to start a freelance career but so far I'm not having any luck so I was hoping if I post my socials, what I have been currently doing and the things I'm thinking about doing someone could give me some feedback or tell me what I'm doing wrong.

So far I have been posting twice a week to my business's instagram and Facebook page as well as about 10 Facebook groups for my local area. My post consists of a infographic as well as a bunch of hash tags, a link to sign up for my email marketing and my email for them to contact me. I also have a seprate page that is just a regular personal page since it will not allow me to send messages from my company page. What I will also do is find 3 Facebook pages per day that don't have a website and send them a short message to see if they are interested in design services. I feel I should add that I don't have my phone number in any of my posts or messages because I already get so many spam calls plus with my work schedule I don't answer my phone and I'm more likely to answer an email but so far I have just got a bunch of spam emails.

I'm thinking about doing Facebook, instagram and google paid add as well as depending on what happens with it tiktok, LinkedIn and x I just am trying to figure out what I would use for content on tiktok. I don't want to do any of the sites where you have to pay to bid like fiverr or upwork. Other than that I am open to suggestions.

Here are my socials.

[https://daniromancreative.com](https://daniromancreative.com/)

[https://www.facebook.com/DaniRomanCreative](https://www.facebook.com/DaniRomanCreative)

[https://www.instagram.com/daniromancreative/](https://www.instagram.com/daniromancreative/)

What do I need to change or improve in order to improve marketing and get customers?"
4,how do you get qualified leads for a B2B mobile app maintenance service?,r/MarketingHelp,Katana_1170,1,7,https://www.reddit.com/r/MarketingHelp/comments/1la0d1b/how_do_you_get_qualified_leads_for_a_b2b_mobile/,"i’m one of the co-founders of a software dev agency. we’ve been building mobile apps for 8+ years and recently spun off a focused B2B service: post-launch app maintenance. it’s for companies that already have a live app and need help keeping their app stable after launch.

this isn’t about building new apps. it’s about helping teams who already launched and don’t have the bandwidth or resources to keep things running properly.

the problem: we’re really struggling to get in front of the right people.

we tried google ads but didn’t get much traction. cold outreach has mostly been ignored. we’ve started working on content, but SEO will take time and we’re still figuring out how to aim it when we can’t clearly identify the audience. we wanted to try targeting app owners directly, but honestly haven’t found a good tool for that. 

we’ve got two marketing people on the team doing everything they can, but maybe this needs a totally different approach. we’re open to testing new positioning, offers, lead gen tactics — whatever it takes.

so, if you’ve worked on a B2B service like this before (especially something technical or post-MVP), i’d love to hear what’s worked for you. any ideas, tools, or examples are super welcome."
4,🎯 Want More Engagement? Start By Giving Value First!,r/MarketingHelp,Expensive-Long344,1,7,https://www.reddit.com/r/MarketingHelp/comments/1hfjk9r/want_more_engagement_start_by_giving_value_first/,"Why do some posts take off while others vanish into the void? Simple: they *lead with value*. You instantly stand out when you share something that helps, inspires, or entertains. Here’s how you can do it too:

**🔑 1. Solve Problems**

Think about your audience. What do they need help with? Answer questions, share quick tips, or offer a solution they’ll use. *Helpful = Memorable.*

**🔑 2. Share Unique Insights**

Your personal experience is powerful. Share a win, a fail, or a lesson learned. Real stories hit harder than generic advice.

**🔑 3. Be Consistently Useful**

Don’t just drop one good post and vanish. Show up regularly. The more people see you adding value, the more they trust and follow you.

Leading with value isn’t just about posts—it’s about building trust. What’s one way you’ve added value recently? Let’s trade ideas below! 👇🔥"
4,Need Help with best Canadian fashion influencers,r/MarketingHelp,mediiivh,6,6,https://www.reddit.com/r/MarketingHelp/comments/1h12bqo/need_help_with_best_canadian_fashion_influencers/,"Hey everyone,  
was wondering if there is a list of the est Canadian fashion influencers out there or even a platform to search for them efficiently so I can contact them about our new fashion business.   
Thanks in advance."
4,Need help marketing my email wait-list signups.,r/MarketingHelp,videogamebruh,3,9,https://www.reddit.com/r/MarketingHelp/comments/1bw2j6a/need_help_marketing_my_email_waitlist_signups/,"Hello all! To preface this, I am absolutely not a marketer, I know practically nothing about marketing. I'm a developer and administrator, I write the code and handle the legal side.

I founded my company, and we finally launched our email wait-list for our first product (https://fcloud.app). I don't know how to market this at all, and promote it so people will sign up and eventually convert. If there is anything you guys can show me, or any tips you have so I can get people to sign up (Preferably not just family/friends) that would be very helpful. 

I've also been looking into paying a freelance marketer to do marketing for me and take that off my plate so I can focus on development. Would this be a good idea or is it just gonna be a pain in the ass?

Thank you!"
4,Help getting more clients,r/SmallBusinessOwners,MatthewVivaDigital,5,6,https://www.reddit.com/r/SmallBusinessOwners/comments/1ketca8/help_getting_more_clients/,"Hey everyone I have a marketing agency and I know what you guys are gonna say. How are you a marketing agency but don’t know ho to market and get your own clients. We run paid ads, seo, and email/ sms marketing. Problem is I don’t have a budget to run ads so that’s out of the picture and seo is long term so it takes a while before that starts to show results. Anyways I need help trying to get more clients. Where can I look what do I pitch. I have a couple of offers I tried such as 30 day free trials, free google profile optimization. But I’ve contacted around 300 businesses one by one and not a single good lead. These have been personal so I’m giving them advice on what I see on their digital presence, such as website, google profile. Just looking to get more clients. Any other ideas, I’ve tried some cold calling but open to do more. However I’ve done a lot of emails and direct messages me just don’t know what would work best. Any advice is appreciated thank you!"
4,"A challenge, maybe!",r/automation,cozycorner,1,7,https://www.reddit.com/r/automation/comments/1lotpqu/a_challenge_maybe/,"I have an interesting use case (or maybe not, but it’s interesting to me!) . I am a college academic advisor, and I’m trying to think of ways to automate some parts of the job so I can spend better one on one time. I spend ages explaining the same confusing aspects of a couple of health programs and aces on answering financial aid queries (and it is not even my area, but I’m there and handy, so I get asked a lot of questions). I answer hundreds upon hundreds of emails. 

I don’t know exactly what I’m looking for and maybe need help articulating it, but there has to be some way to automate answering routine questions or getting the nursing info answered by a generated video, or having someway to automate standard emails. Yes, I have auto responses and Outlook templates and quick parts and such (work won’t give us the Outlook AI plug in). What can I do to do a better job for my students and help my burnout? I’m in an AI group at my employer as we try to figure out good uses and prevent the bad, but it’s hard to think of what to automate or AI-enhance in a job that is so traditionally one on one. I don’t want to not work—I just want to make it better for all parties. 

Any ideas? I’m setting myself up a self-study course on different tools, but this is more a conceptual thing. Thanks!"
4,Need help with finding clients. - Automation,r/automation,tinusandy,2,15,https://www.reddit.com/r/automation/comments/1ljvn0c/need_help_with_finding_clients_automation/,"Hi, I am an experienced automation workflow and RPA developer and have developed worflows on MS powerplatform and N8N. 
Now I would like to start as a freelancer but the problem i am facing is that I am not into sales and have no idea about sales, outreach etc. 
I am open to collaborate with someone who can find me clients. 
"
4,Identifying numbers that both have right and left,r/excel,peyipay,5,17,https://www.reddit.com/r/excel/comments/1lsxxo5/identifying_numbers_that_both_have_right_and_left/,"I am doing a medical audit wherein in Column A, I have all the patient numbers which underwent injections, and on Column B, it's listed if right or left side injections.

I've shared an image of how my sheet looks but it's more complicated than that and the number of rows are &gt;6000, so definitely I'd need help with Excel formulas.

Is there any way I can identify patient ID numbers that both have Right/Left entries? For example, here in this example, patients 101, 103 105 are the  patients with both Right/Left entries.

https://preview.redd.it/e6nlwh2ec8bf1.png?width=247&amp;format=png&amp;auto=webp&amp;s=bd2ad3e35aae94e85a025ea5704b0db26adde48c"
4,Strength Coach Learning Excel — Need Help Fixing Template Macros &amp; Batch Saving Forms (Windows),r/excel,mogotraining,1,8,https://www.reddit.com/r/excel/comments/1lrbx8a/strength_coach_learning_excel_need_help_fixing/,"Hi all,

I’m Coach Morgan — I work with the Chinese National Wrestling Team, and I’ve been using Excel to manage athlete training data. I’ve taken formal Courses, online courses and have been trying to build a template system for my team. Currently I do all the data entry and everything manually, but I purchased a template which has many of the features I want and need, but the template doesn't work properly, and I haven't been able to get a hold of or help from the creator.

I really want to learn how to build something like the original, but be able to do some more custom things, but I recognize it will take some time, so while I will move in that direction, I want to adapt this template for current use.  Currently it just functions a little poorly, the macros are slow, and the dropboxes dont work great.  The Sheet is kind of locked, so I don't know what I can do to make adjustments.  

Maybe I can make a duplicate and learn how to do these functions myself? 

how the workflow currently works:

1. I create template for team/athlete
2. I send to my translator
3. He sends to assistant coach
4. Assistant Coach hosts on chinese cloud which athletes can log onto (called tencent systems)
5. Athletes log in remotely and fill in training data
6. I download the spreadsheet with their data.
7. I manually extract their data into a spreadsheet
8. Create charts and analysis
9. Send analysis to federation and Other coaches for training adjustments and discussion

I DO THIS all manually, but I'd like to automate or streamline some of the process. I have the system i've build, which is very rudimentary, or I can adapt something someone has already made into something that Is more direct for my needs.



# With their template: Current Problems I’m Facing:

* The Excel template has poor interface (clickers and sliders slow).
* I’d like to **batch save multiple sheets ( or a team) into a single template** (each filled for an athlete) into a folder, ideally with custom names like: `AthleteName_TrainingDate.xlsx`

#  What I’m Trying to Learn:

* How to fix/save macros on Windows (or rewrite them)
* How to make a button/macro that batch saves each athlete’s sheet
* Where to start learning the VBA needed to do these kinds of things

# Extra Context:

* Eventually, I want to build a full multi-language system that allows athletes and coaches to log training and testing data offline or online — but right now, I’m focused on **Phase 1: Getting these basic Excel functions working**.
* Finding a way to build calculations into these sheets, without tampering the printing area or client interface part of the sheet.

I’m totally open to learning and doing the work — I just need help getting oriented. If anyone has good resources, sample code, or is willing to point me in the right direction, I’d really appreciate it.

Thank you 🙏  
— Coach Morgan"
4,CountIfs in three columns,r/excel,Donni80,2,6,https://www.reddit.com/r/excel/comments/1lp85d7/countifs_in_three_columns/,"I need help with a formula to count the calls on the same day for two phone numbers within a time frame of before noon and the second formula after noon.

Date is in column A in this format Thu Sep 13 2008. Phone number in Column C  803-555-5151 and 803-555-5152 .  Time is in Colum B in this format 1:16:00 PM.  Column ranges are 2:20400   before 12:01 pm and second formula after 12:01 pm

Now I know i am going out on a limb here, but life would be wonderful if there is a formula to color code the font for the row or highlight the row for these calls.  Not necessary, but would be delightful to be able to know where they are located. "
4,2 cell can be edited,r/excel,kawaiicelyynna,2,9,https://www.reddit.com/r/excel/comments/1loj581/2_cell_can_be_edited/,"Hi, 

I need help on protecting sheets, I have 2 cells that I want to be edited or can be edited (drop down and manual typing of year) and the rest of the cells is protected since it has a formula. How can I do it? 
Thanks for the help "
4,How do I start eating healthy?,r/productivity,Kooky_Homework_6829,6,11,https://www.reddit.com/r/productivity/comments/1lki3qu/how_do_i_start_eating_healthy/,My dad has warned me for a while now that I shouldn’t eat too much as a sprinter. I used to think I was skinny but I’m starting to realize that I might be gaining weight. I say I want to eat healthier this summer but I find it a bit difficult to do it. I need help on how to eat healthier and to start being more productive in my life as a teen. 
4,Need help understanding hour expectations,r/freelance,AncientSpecialist888,3,11,https://www.reddit.com/r/freelance/comments/1iycsvq/need_help_understanding_hour_expectations/,"I'm about to start a role where the client was looking for someone to be completely dedicated to their projects, 9–5 Monday–Friday. My understanding is that in these types of roles, you usually bill the client for simply having a hold on your time, regardless of the exact time spent working. So essentially this would be 40 hours billed every week.

In my case, I have some other projects that I had already signed on to, so I won't be exclusively dedicated to them, which I explained to them. But I do still think the expectation is that I'll be available more or less whenever I'm needed within working hours.

I'm wondering how I should plan to bill them—if they know that I have other projects going on but they expect me to generally be available 9–5, should I bill them for being available? Or just for the hours worked?"
4,hey need help for contract,r/freelance,Nervous_Jump8341,5,10,https://www.reddit.com/r/freelance/comments/1ixpbj4/hey_need_help_for_contract/,"I am new to freelancing, and I want to sign a contract before work. How can I do this? I could just send a PDF to WhatsApp or email and ask the client to review it, or use some other professional tools, but none of them are free.  
any guidance will help me a lot   
thank you "
4,finally started getting real results with abandoned cart recovery (not just spammy emails),r/ecommerce,CommunicationOdd838,9,6,https://www.reddit.com/r/ecommerce/comments/1l8g8ip/finally_started_getting_real_results_with/,"i see a ton of posts from new folks struggling with abandoned carts, so figured i’d share what actually worked for me after building a few 6- and 7-figure stores (and burning through a bunch of stuff that didn’t).for the longest time, i just used those default “hey, you forgot something!” emails and, honestly, barely got any carts back. it always felt like i was annoying people more than helping them whoc really hurt my brand in the beginning (so be careful, word of month is what can either kill your business or grow). so i switched it up and started treating every follow-up like i was from support team trying to help. here’s the mix that finally worked personally for me:

* mention the actual product they left, not just “hey \[name\]”—makes it feel like you actually care
* ask if anything was confusing or if they had a question, not just “complete your order”
* offer a little help, like “want me to hold this for you?” or “need help with shipping?”
* drop in a quick customer review, something real, not a fake testimonial
* always mention your return policy—removes a ton of hesitation
* if you can, add a disappearing cart link (bit of fomo, but don’t overdo it)
* automate the messages, but make sure they sound like human, there are tools to help you with this like ours for example ;)

after trying these, my recovery rates jumped from single digits to 25%–40% sometimes. people even replied back and thank me for reaching out (well my AI did but they are welcome i guess), which never happened before.... so honestly even if they dont purchase right away they will keep you in mind and have a good impression about your brand, it makes a huge difference in the long run. Hope that helps. Good luck guys."
4,Looking for a supplier for replica branded clothing or other products (ships straight to the customer),r/ecommerce,P0lpett0n3,0,8,https://www.reddit.com/r/ecommerce/comments/1l48dvv/looking_for_a_supplier_for_replica_branded/,"Hello, I need help finding a supplier for replica branded clothing (or other product, tell me) that ships straight to the customer and possibly accepts cryptocurrencies (preferably xmr or btc) as payment method. I can setup an e-shop fast and start selling in a few days/hours."
4,First Hire for a Family-Owned Business: Tips and Tools for a Smooth Start!,r/ecommerce,Visible-Economics296,4,8,https://www.reddit.com/r/ecommerce/comments/1l1lbq0/first_hire_for_a_familyowned_business_tips_and/,"A family friend started an online business selling celebration cards and gift baskets. They want their first hire to help out with emails, social media messages, order tracking and that sort of admin work. This is their first hire, and they need help within the next 30 days. Are there any routines, documents, tools, or recommendations that can help them hit the ground running? They want to keep the family culture working environment while keeping to deadlines. What can we do? "
4,"Tenant mistakenly sent payment to my HOA instead of me, How do i fix this issue?",r/Bookkeeping,galacticjuggernaut,6,9,https://www.reddit.com/r/Bookkeeping/comments/1lpak1v/tenant_mistakenly_sent_payment_to_my_hoa_instead/,"Not a bookeeper, so hence my ask and need help.  I use Zoho books which i love. 

My HOA bills me for utilities and HOA assessment, so in turn i have to pay the HOA and then send the tenants an invoice for the utilities. This typically works with no issue.

But last month they accidentally sent the payment directly to the HOA.  So now i have a credit with the HOA (which has since been eaten by the new charges), an outstanding overdue invoice in my accounting system, and of course the tenants have a $0 balance.

How do i properly indicate the invoice was paid, as i need to track it for my records, but without causing an accounting issue, as now my bank is short the expected utility amount.  If i deleted the invoice that would fix the issue of course, but this just seems like the incorrect way to do it.

Hope this makes sense."
4,i can't handle customers anymore,r/CustomerService,bog-fish,10,7,https://www.reddit.com/r/CustomerService/comments/1jxlfxj/i_cant_handle_customers_anymore/,"for context, i've worked in retail for 3+ years and food service before that. i've had my fair share of entitled and horrible customers, as well as amazing ones.

95% of my customers are straight up rude and entitled and when i greet them (as i have to) they cut me off and tell me they need nothing. understandable, but i get in trouble if i do not talk to them. i check on them to see if they need help? shut down. i'm used to it but it seems nowadays either customers have gotten worse and intolerable most of the time or maybe i just can't deal with customers anymore.

is there any way i can sort of dull that feeling down? it's the only job i've managed to get and the pay is honestly horrendous but it's necessary. it's so hard to be kind and friendly to these people."
4,My manager brings her young son into work when she’s the only manager on duty while constantly riding me for legitimately no reason. What should I do?,r/CustomerService,Huge-Possibility1918,14,2,https://www.reddit.com/r/CustomerService/comments/1jpepcd/my_manager_brings_her_young_son_into_work_when/,"So I’m a butcher working at Safeway. I’ve been a butcher for 3 years before coming to Safeway to be a butcher. I take lots of pride in doing a good job at work and making sure everything looks nice as I can make it. I genuinely enjoy my job and I do a good job. None of my managers have any issue with me at all. But one manager we can call (L) always picks on things I do and always tries to blame me for not doing stuff. To the point where my coworker will have to tell her that I did indeed do my job properly. She also comes into the butcher area and will touch, squeeze, and flirt with the other butcher I work with in front of me. I find it highly inappropriate. But she also brings her probably 8 year old son to work a couple times a week when she’s the only manager on duty. I’m tired of her coming at me for no reason at all. How and who do I go about telling someone higher up she’s bringing her son into work? I wouldn’t bring up the touching thing because I would not want to involve the other butcher. But I’m so fed up of her doing this and need help figuring out what to do. "
4,I need help opening walmart links in the app?,r/workflow,oaxaquitoward,2,10,https://www.reddit.com/r/workflow/comments/9qf2gw/i_need_help_opening_walmart_links_in_the_app/,"I have made a workflow that scans a bar-code, and then searches for that item in walmart.  I can't however, get it to search in the app.  It will search for the item in safari.  Any thoughts on the correct URL to make it search in the app? "
4,Advanced Workflow Help?,r/workflow,mikeyninja,3,13,https://www.reddit.com/r/workflow/comments/9kjymo/advanced_workflow_help/,"Hi everyone!

&amp;#x200B;

Need help with a somewhat advanced workflow, not sure where to send this to so posting here. I'm looking to do the following:

&amp;#x200B;

Input a variable to somewhere and get a Return of different variables that I specified, each with a name and a value, that would fit into other steps in the workflow.

&amp;#x200B;

So for example, it would work as follows:

&amp;#x200B;

INPUT I pass from Workflow: GroceryList01

&amp;#x200B;

OUTPUT returned to workflow:

Dairy01: Milk

Veggies01: Broccoli

Veggies02: Carrots

&amp;#x200B;

Or in another instance, if the input was let's say: GroceryList02

&amp;#x200B;

Output would be:

Dairy01: Yogurt

Veggies01: Radish

Veggies02: Zucchini

&amp;#x200B;

The output values would be pre-determined by me (i.e. Dairy01, Veggies01, Veggies02 are pre-determined variable names with fixed values they'd return based on the specific input).

&amp;#x200B;

I would use whatever the output returns for Dairy01, Veggies01, Veggies02 in future steps in the workflow.

&amp;#x200B;

I hope this makes sense! I considered using URL webhooks for it as it seems to be the simplest way but am a noob at this stuff so would love to see if anybody has thoughts on the easiest way I can do this. Thank you so much &lt;3"
4,Need help creating a workflow that shuffles music by not recently played,r/workflow,sku11_kn1ght,0,14,https://www.reddit.com/r/workflow/comments/99e2ms/need_help_creating_a_workflow_that_shuffles_music/,"I hate the ios music app, just because despite having 1000+ songs on my phone it seems to play the same ones over and over. Can I get some suggestions to create a workflow for a better shuffle? The one I created adds audiobooks for some reason, so Id like to exclude that."
4,Need help with “if” after a menu,r/workflow,securitybenji,0,14,https://www.reddit.com/r/workflow/comments/99c211/need_help_with_if_after_a_menu/,"Hi, I need a hand with setting up this workflow. It’s an incident report set To send an SMS message, 

This is what I have so far: https://workflow.is/workflows/0da63473e9854f32a4400b7d149f4885

I want to ask if there is property damage and if yes then ask for further details and ask for photos and if no then end but at the moment no matter what I try it just skips asking for further info and the photos. 

Please Help!!! Tia"
4,need help converting Cº to Fº in a weather wf,r/workflow,zebrathon,2,7,https://www.reddit.com/r/workflow/comments/998ydz/need_help_converting_cº_to_fº_in_a_weather_wf/,"new to the workflow thing and need help tweaking an existing WF....need to change output from Cº to Fº

https://workflow.is/workflows/0f8b7825c79740bca621e142b589b6f8 "
