Score,Title,Subreddit,Author,Upvotes,Comments,URL,Content
3,Where Can I Buy High-Quality Twitter (X) Followers &amp; Likes,r/DigitalMarketingHelp,chimpadi,1,1,https://www.reddit.com/r/DigitalMarketingHelp/comments/1l0m96t/where_can_i_buy_highquality_twitter_x_followers/,"

I’ve been trying to grow my presence on Twitter (X) and wanted to ask if anyone knows a good place to buy high-quality followers and likes. I’ve seen a bunch of services online, but most of them seem sketchy or ask for logins, which I’m not comfortable with. 

After a bit of searching, I came across [Media Mister](https://www.mediamister.com/buy-x-likes#a_aid=2022&amp;chan=WCIBH), and it’s been the best and safest option so far. Their services are real, legit, and completely secure—no password needed. The delivery was instant, and the quality felt authentic and organic, not fake-looking at all. 

They also offer affordable, low-cost packages with quick delivery, and there’s even 24/7 support if you need help. Everything is automatic and works well without any issues. 

If you’ve tried buying followers or likes for Twitter (X), which service worked best for you? I’d really like to know what’s trusted and effective out there.
"
3,Need help with Marketing AI agent tool,r/DigitalMarketingHelp,Subject_Gas5172,1,2,https://www.reddit.com/r/DigitalMarketingHelp/comments/1kmjaff/need_help_with_marketing_ai_agent_tool/,"Hey all, I've been building an AI marketing tool and wanted to see somethings that people would like specifically on the tool? It's great at content creation, creates custom posts, ads, and captions. It also auto-schedules posts for the best time based on maximum outreach for your desired target audience. I'm thinking of adding a feature that tweaks campaigns on the fly based on user feedback and gives you analytics to see what's working and what's not working. would love any feedback from y'all. Not selling the tool on this forum, just want testing feedback. Feel free to interact on the thread or message me directly."
3,Need help with content ideas?,r/DigitalMarketingHelp,wpgeek922,0,4,https://www.reddit.com/r/DigitalMarketingHelp/comments/1khl15t/need_help_with_content_ideas/,"Hey guys, If you're stuck on what to post next, drop your niche or a keyword in the comments I’ll send you 3 content ideas you can use right away.

I’m working on a tool that helps with content planning, and I’d love to get your feedback while helping out.

No AI fluff. Just quick, useful ideas."
3,Need help in Revamping my agency,r/DigitalMarketingHelp,NoPaleontologist3570,1,4,https://www.reddit.com/r/DigitalMarketingHelp/comments/1k63xd8/need_help_in_revamping_my_agency/,"Hi all, I am from India and I started Digital marketing agency a year back got some small clients via some network. Also got one big client (even though the amout of work was not very large but the client is very big so good for portfolio) that too via network. post that for some time i didn't get the chance to pick new clients due to full time job commitments (i am a software engineer in a global MNC). so now i am Revamping the whole business and looking for a fresh start and looking to get clients in USA. Tbh i am not sure how to get started. How to get clients in a different nation without any network or referral. Any help would be highly appreciated. Thanks."
3,Need help mock-up case,r/DigitalMarketingHelp,Traditional-Rub6672,1,0,https://www.reddit.com/r/DigitalMarketingHelp/comments/1i2q1wf/need_help_mockup_case/,"Hello! I need to create an online strategy for a lawn service company that operates in Texas, Florida, South, Midwest. I have to analyze the data and then build recommendations ( shift budgets, ad formats, platforms) while maintaining my CPL as low as possible. Midwest and south have the highest results in social, Florida in search and Texas has the worst results on both [platforms.How](http://platforms.How) to go from there?"
3,Commercial for an App,r/DigitalMarketingHelp,lsaiahflores,3,1,https://www.reddit.com/r/DigitalMarketingHelp/comments/1derkyh/commercial_for_an_app/,"I need help trying to make a commercial / ad for a mobile app. I built an apartment locator CRM and want to make a cool ad for it. I’m curious if anyone has ever done something like this making ads for an app any advice would be great 

The goal would be to showcase the main features of the app with some cool text overlaying the video 
I’ve seen people who make these on Fiverr and might end up going that route but if I can do it myself somehow I’d love to save the money

Any advice would be great !
"
3,Built a Hinge Dating Assistant,r/MarketingHelp,Ok-Current1108,1,1,https://www.reddit.com/r/MarketingHelp/comments/1kzkdbn/built_a_hinge_dating_assistant/,"Built a Hinge Dating Assistant for men to help them get matches and ditch the swiping. If Hinge users have Hinge Premium and have open Dating Preferences in big cities, this helps them get matches and increase their chances and improve their dating life 10X.

I am the founder and am genuinely looking for some feedback for the website. We have 100+ users and most if not all are happy with the results.

I am looking for some help on how to market it since I am from the tech side only. Would really appreciate some help to some niches I haven't tried exploring. I'm based in NY, so opportunity is immense but need help with ideas / implementation.

Ideal customer would be late 20s men who use Hinge+ since this would immensely 10X their dating life.

I am looking for genuine responses.

[https://theloveguru.ai](https://theloveguru.ai/)"
3,How do you find leads?,r/MarketingHelp,Jazzlike_Tooth929,2,5,https://www.reddit.com/r/MarketingHelp/comments/1ko2ftm/how_do_you_find_leads/,"Hi, I'm new to this field and need help. How do you find leads for outbound contact? Is there a standard set of tools people use (any you recommend)? Beyond contact information, what other information about the leads do you get and how? Thanks a lot"
3,Strategy for selling business management software to Gas stations,r/MarketingHelp,Ok-Succotash-5660,1,2,https://www.reddit.com/r/MarketingHelp/comments/1jsuf82/strategy_for_selling_business_management_software/,"Hey guys, I recently started working as a marketing strategist for a software solutions company. Our main product — and the one that brings the most value to the company is a fiscalization and business management software.

Our marketing team originally consisted of three people: me, another beginner like myself, and a senior marketer. Unfortunately, our senior left recently due to other commitments (he started his own e-commerce business and also manages social media for several clients). Now, it’s just the two of us handling all marketing efforts.

Recently, our manager came up with the idea to target gas stations with our software, since some of them also own chain stores and represent big business opportunities. He asked us to come up with a plan for how we’re going to sell our solution to these gas stations.

To be honest, I feel a bit overwhelmed — we're being asked to do a lot given our experience level. But at the same time, I really want to rise to the challenge.

I have experience in social media management, Facebook and Instagram ads, WordPress web development, basic design in Photoshop, and wireframing with Figma. But this project requires something different — more like traditional marketing and strategic planning.

Right now, I have a solid starting point: I’ve identified the target market, and I know how to reach them. In Albania, we have a good website , where I can find all gas stations along with their contact information, so I can start building a lead list.

I'm also planning to run Facebook ads, since I don’t think Google Ads are very effective in Albania.  
So, the two main channels I’m considering are Facebook advertising and direct phone calls. I’m also thinking about designing some brochures and delivering them directly to the gas stations. To be honest, I can’t think of any other effective ways to reach them at the moment. As for the offer, that’s something I’ll need to discuss further with the manager of course. What I really need help with is the **mindset and the blueprint** — how would an expert approach this situation? What would a complete strategy look like? And how long might it reasonably take to execute?

The good news is, I’m not alone. Our company has a variety of resources — designers, actors for ad production, a solid development team, etc. But they all need guidance, and I’m supposed to be the one who brings the pieces together and forms a cohesive strategy.

Any tips, guidance, or constructive feedback would be greatly appreciated!"
3,help marketing a mobile app via instagram comments / ads,r/MarketingHelp,Misura_k,1,2,https://www.reddit.com/r/MarketingHelp/comments/1jsr2r7/help_marketing_a_mobile_app_via_instagram/,"I have created a mobile app and I need help getting traction for it. I have tried posting on reddit threads which have gotten me some sign ups but no-one seems to use the premium features (even when there is a trial offered)

Would an approach be use the app's instagram account to comment on couples or people commenting on relationships to increase engagement to my app's instagram page for I can get more sign ups.

Open to suggestions or any means of being better at marketing the product."
3,Strategic Marketing Plan for New Wellness E-commerce (Zero Budget to First Sales) :chart_with_upwards_trend:,r/MarketingHelp,Big-Cash-1741,1,5,https://www.reddit.com/r/MarketingHelp/comments/1jlbm3b/strategic_marketing_plan_for_new_wellness/,"Hi marketing experts! I've just finished setting up my wellness e-commerce store (think natural self-care products, aromatherapy essentials). After learning from countless startup stories here, I know the early marketing moves are crucial.Competition analysis shows most players in my space focus heavily on paid social. However, I'm seeing potential gaps in organic content and community building.What I'm Working With:  
Fresh Shopify store with 15 products  
Basic social media accounts  
$400 monthly marketing budget  
10 hours/week for marketing activitiesWhat I Need Help With:  
Looking for guidance on building a lean but effective marketing system for the first 90 days. Should I prioritize organic social growth, content marketing, or community building? What metrics should I track from day one?My target customers are wellness-focused individuals who value natural products and sustainable living. Average product price point is $35.  
Would really appreciate insights from those who've grown similar e-commerce brands! "
3,Reliable Influencer payment platform for our situation with recent influencers,r/MarketingHelp,mediiivh,0,4,https://www.reddit.com/r/MarketingHelp/comments/1h4oxi4/reliable_influencer_payment_platform_for_our/,"Hi marketers,  
I have a serious situation at hand and need help pls. We are a somewhat new business in fashion and beauty, and we are working with some nano influencers. It was fine until one of the girls started to show some signs of being off and not delivering what we needed from her.  
we had to stop working with her but it was time-consuming and the process was really tiring.  
Now what we want is a tool or platform to find reliable influencers and play the middleman role for us.  
What I'm asking here is if anyone knows some sort of platform that be able to manage the payment process and find good influencers for our next contracts.  
Thanks everyone in advance for your help.

Update:  
We received many suggestions in the comments about different platforms. The one that we went for is [Ainfluencer](https://ainfluencer.com/). It is free and their Escrow system made our life much easier. It granted us many filters for finding influencers in our niche and contacting them most simply. We are at the start and satisfied. I will update this post later with more information."
3,Question: Help Finding SEO Meta for Particular Page Title,r/MarketingHelp,Crafty_Librarian_841,1,2,https://www.reddit.com/r/MarketingHelp/comments/1gmc55s/question_help_finding_seo_meta_for_particular/,"Hello. I need help finding where google retrieved the title (just my site.com) listed as title. See screenshot. Any help appreciated. 

[https://imgur.com/oRNo7MW](https://imgur.com/oRNo7MW)"
3,We need help on getting the last 330.000 signatures!,r/MarketingHelp,My-Voice-My-Choice,2,4,https://www.reddit.com/r/MarketingHelp/comments/1g9hvg2/we_need_help_on_getting_the_last_330000_signatures/,"Hey 

We are the team behind My Voice, My Choice - a movement of friends and we’re fighting for safe accessible abortion in the EU.

Sign for safe abortion here:[ https://eci.ec.europa.eu/044/public/#/screen/home](https://eci.ec.europa.eu/044/public/#/screen/home)

Over 20 million women across the EU still face barriers accessing basic healthcare. In Poland, women die due to abortion bans, while in Malta, women can risk prison for seeking the pressure. The European Citizens' Initiative ""My Voice, My Choice"" is fighting to change this.

  
Do you have any help on how to get the last few signatures? We are feeling somewhat discouraged as we haven't seen much progress lately :(

"
3,Need help to promote my Chrome extension,r/MarketingHelp,Contentifyy,0,1,https://www.reddit.com/r/MarketingHelp/comments/1ew8r2v/need_help_to_promote_my_chrome_extension/,"I have this FREE chrome extension for Amazon and Kindle users. Kindly let me know what type of promotion will suite this? 

Ease Your Amazon Shopping Experience with Our FREE Chrome Extension! 

https://chromewebstore.google.com/detail/amazon-kindle-product-pre/moigbafcjbfekhhalekloooobhdgchag 

Function: Instantly preview Amazon and Kindle product and books details and prices from details page on any page without leaving the page! Just on mouseover.
"
3,Need help with Google Analytics,r/MarketingHelp,C_Me,2,1,https://www.reddit.com/r/MarketingHelp/comments/1dirkxv/need_help_with_google_analytics/,"I haven't used Google Analytics in a while and am re-teaching myself. I feel like this question should be simple and basic, and I thought I knew how to do it, but when I try to do it isn't reflecting in the reporting. So I must be doing something wrong.

So I set up a collection of basic tracking links in Google's Campaign Builder: https://ga-dev-tools.google/campaign-url-builder/

Let's say I just used the Campaign Source... we're keeping things simple and just want to pull together basic data on 10-20 different sources.

So the links end up with URLs that look like this: /?utm_source=WCHFH_Facebook_Post

How do I build a report that reflects traffic from this source? I do things like adding a filter to that campaign in a bunch of different ways and no matter what I can't create a report that captures that campaign source. I keep reading the same instructions online. It doesn't work. I keep getting ""No data available"". Is there somewhere that has a step-by-step for this basic process? Or can someone in basic terms describe if they had a source ""WCHFH_Facebook_Post"" how they would set up a report that reflects traffic from this source (and connect it to an event).

Thanks for any help you can give me."
3,I Need help with a Reach&amp;Frequency Meta Campaign,r/MarketingHelp,Edelweiss003,2,1,https://www.reddit.com/r/MarketingHelp/comments/1de5wa5/i_need_help_with_a_reachfrequency_meta_campaign/,So I created a campaign medical purposes and specifically for doctors segmentation and im trying to keep it tight. The estimated reach meta throws me is around 30k - 40k but after 4 or 5 days the campaign starts getting +100k reach. We are worried this is showing to people who are not in our medical segmentation because of legal issues. It's the second time we create the same campaign and have the same problem after 5-7 days. Anyone knows what exactly is going on?
3,Need help with LinkedIn Ads please,r/MarketingHelp,krazecat,2,4,https://www.reddit.com/r/MarketingHelp/comments/1cgnfoy/need_help_with_linkedin_ads_please/,"Hi everyone,

I am running a LinkedIn ad for a B2B software company. It's a website clicks campaign with a tight budget-800 currently on max delivery started Thursday with 4 creatives. The audience is about 220k

I know it's still early, but we only have 8 clicks, 5 of them on one of the creatives and the cpc is now at €16 because 2 of the creatives are not getting anything. I've now turned them off and left the other 2 on -they all had the same video anyway.

Should I go with manual bidding and only the 2 creatives I have? Is there anything else i can do?

Thanks!"
3,What tool/tech you are using to track conversions,r/MarketingHelp,neerajdotname,1,2,https://www.reddit.com/r/MarketingHelp/comments/1bz1j54/what_tooltech_you_are_using_to_track_conversions/,"I need help to measure marketing conversions. I'm talking about something other than the tools to do digital marketing. I'm talking about the tools required to track the percentage of people coming to the site and signing up. 

&amp;#x200B;

If I spend $200 on LinkedIn, Twitter and Instagram, how do you track which medium brought the maximum number of users?

&amp;#x200B;

Please let me know what tool/tech you use to track the conversion and marketing metrics. "
3,Need help with Marketing for Healthcare Org,r/MarketingHelp,ProfessionalDish34,1,4,https://www.reddit.com/r/MarketingHelp/comments/1bnm8oc/need_help_with_marketing_for_healthcare_org/,"Hi guys, i’m the marketing staff for this company, is there anything we can do increase engagement rate for this page: https://www.linkedin.com/company/sparkconfer/
"
3,The new 4-step formula to effortlessly craft show-stopping headlines that get people to stop scrolling (backed by buyer-psychology),r/MarketingHelp,Popular_Lab_1302,5,1,https://www.reddit.com/r/MarketingHelp/comments/1bb5kph/the_new_4step_formula_to_effortlessly_craft/,"Let me guess. 

You know how to produce great content with immense value,

Or you’re selling a life-changing solution,

But you just can’t get people into your pipeline?

Here’s a quick &amp; easy way to skyrocket the # of eyeballs your catch. 

Whether it’s a salespage, video title/caption, or any form of content/copy,

where you have one shot at capturing attention for that specific content,

With just one single sentence (your headline),

Here’s the new formula to apply:

✨NESB✨

”Oooo what bird breed is that?”

It’s not lol. It stands for new, easy, safe, and big. 

NESB is proven to be the most powerful way to create headlines that people just cannot ignore.

Why?

Because it appeals directly to our most basic instincts as humans (buyer psychology).

Here’s how:

NEW-

This means you position yourself/your offer/your content/solution as if it’s something new,

You’re the only person who has that solution,

ORRR you’re the only person who can offer the solution in that ~specific~ way. 

People don’t wanna go ”Ah, heard that one before, next!” 

Be the first one. Or make it sound like you are the first one at least. 

EASY-

This one’s pretty obvious…

As human beings, we tend to be attracted by quick-fixes, get-rich-quick schemes, and overnight success,

Which basically means we’re into EASY solutions to our problems, no matter what the problem is. 

Nobody wants to put in extra effort into solving a specific problem if some Joe Shmo offers an ”easier” fix, right?

This also explains why social media is flooded with captions that go something along the lines of:

”The only thing you need to ____”

”The 3-step formula to____”

”Do THIS to ____”

Etc…

Make it sound as easy and effortless as possible :)

Next is SAFE-

On a subconscious level,

One of the decisions a person makes before they decide to spend their time consuming or buying something is,

”Does this actually work?”

And that makes perfect sense. 

Because whether it’s someone’s time or money,

Nobody wants to spend either of those two on something that might not even deliver results or be ”worth their while” in the end. 

So always include an element of safety/guarantee in there. 

And if you’re wondering how,

Well.. that’s another discussion! ;)

And lastly,

BIGGGGG.

Make it sound big, dude. 

People are flooded with information and content and solutions and idk what else,

All. Day. Long. 

If you don’t make your headlines sound significant enough,

No matter how great or life-changing your solution is in itself,

Who’s gonna give you the time of day?

No one.

There’s an art in creating headlines that make a casual scroller go ”Oh. Wait what?!”

And that’s what you should aim for. 

Make it pop. 

So there you have it, folks. 

The 4 most important aspects of a killer headline. 

Remember:

Your headlines will make or break your copy. 

If your headline is crap,

It’ll bury the rest of your copy/content under the ground with zero effort. 

Doesn’t matter if there’s a goldmine in there. 

Make it NESB!🔥

P.S. I’m a copywriter. If you need help with applying this formula (or anything sales-writing related for that matter),

Feel free to message me :)



"
3,I need help with my wordpress website.,r/MarketingHelp,PrestigiousWelder161,1,3,https://www.reddit.com/r/MarketingHelp/comments/1b74zit/i_need_help_with_my_wordpress_website/,"Hi all, I have built wordpress website to sell genuine leather fanny packs. I am not from a tech background but I have taught myself using YouTube tutorials. Please can you provide your reviews on the UI and UX of the website and what all I can do to improve it. I am thinking of running Google Ads on website in future. 

Website URL:

https://leatherfannypack.shop/

"
3,I need help marketing my ecourse,r/MarketingHelp,wholeearthmama,1,1,https://www.reddit.com/r/MarketingHelp/comments/1b3npv7/i_need_help_marketing_my_ecourse/,I need help marketing my ecourse and I'm considering offering a discount to beta testers but I'd like to know is there a recommended standard price many entrepreneurs and teachers work with?  Thoughts? TIA 
3,I Need Help Materializing Vision,r/MarketingHelp,funkymonkey2223,1,1,https://www.reddit.com/r/MarketingHelp/comments/1av11wa/i_need_help_materializing_vision/,"Hi all (25m) Marketing Manager here. 

My journey with marketing has been a long bumpy road with a lot of unexpected turns. But from what I’ve learned now unexpected seems to be a normal day for me lol. 

Although I am only 25 I have almost ten years of marketing experience. From creating campaigns targeting specific audiences, small budgets, big budgets, even bigger budgets, and no budgets I have been able to do most of it all. 

But, my problem is I have yet to do anything that will get me a meeting with an executive board. I am aware things come with time and that might sound a bit optimistic. What I mean is….I have not passed over that threshold of good - &gt; great. 

I would define myself as an idea guy with average implementation skills. I find it hard sometimes to take that in the shower “ah ha” moment and turn it in to an actionable campaign. 

My biggest struggle is pairing my ideas with reputable research that can prove my idea will be a success. I believe until now a lot of my campaigns were assumptions based off anecdotal evidence from my own life, lives of friends, or audience personas.


So the question is what is the best way to go from point A to point B while minimizing risk?

  "
3,The beginning of performance marketing - what should I do?,r/MarketingHelp,Ok-Government-7703,1,4,https://www.reddit.com/r/MarketingHelp/comments/1atxejb/the_beginning_of_performance_marketing_what/,"Hi, I'm a novice marketer who need help with tracking traffic on the website and the effects of the ad.(English is my second language so if any of my writing doesn't convey the meaning, please comment and I will try to explain better.)

\-Situation-

We have a website and started our first Meta ad(IG/FB) that leads to the website as the landing page.

We have GA, Meta pixel installed on the website(no events created yet. only page-view) and I see some information on the Ads manager.

**We need to track**

1. The activities(clicking which buttons(most importantly sign up and start button) on the website) of website visitors who visited the website by clicking the link on the ad. Now I only see the number of landing page clicks of the ads (on the ads manager).

**The problem is**

1. I do not know where to start... From my research, I need to do something with GA and Meta pixel events? I am so lost after long hours of research so decided to seek some help.
2. On Facebook events manager to create more events than just page view of the pixel, it says that **there is no pixel detected. Meta pixel helper detects it though**... I clicked 'Add events' -&gt; 'Add on the pixel'.
3. On GA, I do not see there is an event named 'sign up'. Also I don't see the activities of first visitors and how many of them are through the ad.
4. On ads manager, I don't know how to add URL parameters and what parameteres I have to add.

For your reference, our marketing funnel is 1. visit the website 2. sign up 3. click a start button

Any advice? Or just any recommendation of ways of learning like youtube channels? And also if my question is not clear or doesn't provide enough information for you to come up with an answer, please let me know, I will write more information about our situation.

I would really appreciate it if you can help me out here!"
