Score,Title,Subreddit,Author,Upvotes,Comments,URL,Content
9,What is your first step into creating a productive daily routine?,r/productivity,rxzyer,58,48,https://www.reddit.com/r/productivity/comments/1lg3bvt/what_is_your_first_step_into_creating_a/,"Did you immediately create a whole routine and then actually follow through with all of it? Because for me, even starting a productive activity feels so heavy. At the same time, I'm getting tired of seeing myself do nothing productive or beneficial. Especially during this holiday,I just wake up, eat, and then scrolling on my phone all day while feeling useless. GOD, I NEED HELP."
9,My phone addiction is in a chronic stage and I can't stop it.,r/productivity,HomeworkWise5575,84,35,https://www.reddit.com/r/productivity/comments/1lf8qz0/my_phone_addiction_is_in_a_chronic_stage_and_i/,"I use my phone mainly for study purpose but most of the time I waste it on social media and other things . I tried a lot of app blockers but end up uninstalling it everytime I get an urge to check my phone . My  willpower is not so strong. Due to this I can't focus on my career or job. My mental health is destroitating and my physical health too , my marks are degrading as well. All of my friends are getting good jobs but I can't achieve any of my dreams everyday feels like regret and guilt . Please help me fix my life Iam tired of this I need help!!"
9,"Need help, the DMV willnot accept valid insurance",r/legal,More-Adhesiveness254,90,110,https://www.reddit.com/r/legal/comments/1lrdd7b/need_help_the_dmv_willnot_accept_valid_insurance/,"We live in arizona, usa. My girlfriend had her license plate on her car taken by a cop because he said that the DMV stated she  had no insurance.  But she does have insurance and has had insurance for years now. She goes to court shows the proof, the judge tells her she has to go to the DMV and get a paper stating that she was able to provide proof to the dmv or pay $500 fine.
 This is where things  Get frustrating. So she goes to the DMV shows them that she's been insured for years now. shows them the proof which was on her phone because it's an online company. And they proceed to tell her that they do not accept it. they think that it's fake because it's on her phone and she doesn't have an actual physical card.  So she calls her  Insurance  company And ask if they would contact the DMV to get the straightened out. They said it's not  on their end and that they have.  So now she is stuck, don't know what to do or who to talk to or how to go about getting this straightened out. We can't afford to flush $500 on this scam in my opinion. "
9,Is my bio dad allowed to do this LOCATION:Illinois,r/legal,jay_ist_gay,66,130,https://www.reddit.com/r/legal/comments/1lfuekr/is_my_bio_dad_allowed_to_do_this_locationillinois/,"So i am 17 and trans I am planning to change my name soon and got into contact with my bio dad and he is refusing to sign unless I sign something for him before he signs my form
Is he allowed to do this? I genuinely need help with this"
7,"Marketer here, looking to team up with a technical founder",r/startup,JohnnyGazzer,37,37,https://www.reddit.com/r/startup/comments/1lep4zz/marketer_here_looking_to_team_up_with_a_technical/,"Hi, I'm Ani. I have 8+ years of experience in B2B marketing, working with both startups and large companies. I've helped teams with demand generation, go-to-market strategy, and growing their pipeline.

And most importantly, figuring out how to make money

If you're a technical founder building something and need help on the marketing side, let's talk.

No pressure. Just a simple conversation to see if we’re a good fit."
7,Need help managing my emotions on this project/client,r/freelance,BladerKenny333,12,24,https://www.reddit.com/r/freelance/comments/1hublc2/need_help_managing_my_emotions_on_this/,"Not sure where to start but basically I have this client who is starting a new venture and wants me to design a presentation deck that is exciting. The thing is there is no visual branding. She sends me a work in progress content with several slides with barely with content. So I send her back something super basic as I don't have anything to work with, no photos, no colors, not typeface choices and she's not even done with the content. She said it's not exciting which I already know, I don't understand the point of this. Also she's in the middle of getting the branding done by someone so why am I designing anything before that? Then last night she sends me an updated content doc, it's 40 slides and she asks if I can design that in a day. I told her it'll take two days, but I'm starting to get really upset.

Before the presentation she had also sent me some screenshots of logos she likes and asked me to make a logo similar to those. And wanted to see round1 in 2 days. That had already upset me because it's a dumb way of doing logos. I did them, very quickly and she decided to take that part of the project to a branding consultant, which is fine but all these things are really a waste of time.

Any advice in how I should manage this situation? I want to make sure I'm not being controlled by my emotions in this."
7,Help! My marketing activities are through the roof but my ROI is MIA. 😶,r/analytics,the_marketing_geek,22,33,https://www.reddit.com/r/analytics/comments/1kxkf0a/help_my_marketing_activities_are_through_the_roof/,"You guys, I'm need help. We're on multiple channels - Meta, Google Ads, LinkedIn, programmatic, email, now they're whispering about influencers... My screen time is 90% just staring at different dashboards that all tell me slightly different, conflicting stories.

I know leads are coming in, sales are happening, but trying to genuinely trace back which specific ad, touchpoint, or channel actually made someone convert feels like trying to catch smoke with my bare hands. I spend hours seeing reports together, and when my boss asks ""So, what really drove Q3 growth?"" I feel like I'm performing interpretive dance with a spreadsheet, hoping they're mesmerized by the arm-waving. 😑😑😑

How are you all actually making sense of the full customer journey and proving which of your 7,000 marketing activities are the real movers vs. just expensive noise? Is there a way to untangle this mess without needing a PhD?"
7,Am I terrible at my job?,r/Bookkeeping,OutrageousArt7123,24,54,https://www.reddit.com/r/Bookkeeping/comments/1lpn7h1/am_i_terrible_at_my_job/,"Six months ago I started a role as a bookkeeper for a small company (about 30 employees). Im fairly new to bookkeeping and had no experience with payroll or certified payroll. I explained this during the interview process and that I was looking for training and to grow my skill set. I was told they were interested in a candidate who needed training and would train me. 

Fast forward six months and I’m completely overwhelmed. Turns out no one at the company really understood how certified payroll works and I haven’t received much training but I’m expected to handle all of it alone. The person who was “training” me was fired. My boss acts like i’m incompetent but I’m trying to figure it out and when I do know something he doesnt trust what I’m saying and asks for a second opinion. There are no SOPs on how things are done, I’ve just been stumbling along figuring it out. I actually made a lot of notes and SOPs only for them to somehow get deleted by our tech guy?? Things are constantly changing and once I begin a process I have to change it. Employees keep getting moved to different positions with different responsibilities and not knowing how to do their job (which causes a lot of mistakes and makes everyone’s job harder). Most employees are new (within the last year including my boss). My work load seems too heavy for one person and immediately I had to begin putting in 9 hour days (sometimes more but never less). Turns out there’s been high turnover in my position (4-5 people in the last six years). I tell my boss I’m overwhelmed or I need help. He just tells me I need to learn to work faster. 

Every day my boss is constantly telling me what I still haven’t done, to work faster, and pointing out my mistakes. When I ask what specifically he wants me to prioritize, he says everything should be a priority. I started sending him reports of what I’ve worked on and tried explaining that I don’t have enough hours in the day to complete everything. He still says to just work faster. Am I just too slow and not detail oriented enough? I can’t tell if I’m the issue here. 

I’ve tried to quit twice but it would be hard to explain only having six months on my resume for this job. I really like bookkeeping and want more experience but I’ve been crying a lot and super anxious and stressed. I really want to do better with payroll too but I’m not sure it’s for me if I keep making mistakes. It just feels so chaotic here and I’m not sure if this is normal or if I’m just really bad at my job."
7,What do you find to be resistance to businesses getting a bookkeeper,r/Bookkeeping,Longjumping-Let-4358,30,36,https://www.reddit.com/r/Bookkeeping/comments/1l1rqm7/what_do_you_find_to_be_resistance_to_businesses/,"A big argument i hear when talking to businesses on reasons they don't need a bookkeeper is they don't have the finances to have one or they can do it themselves. While this cn be true in the very early stages I think after a year in and especially for restaurants it becomes more important to have a dedicated bookkeeper. I have a friend who is a business owner of a bar and does his books only enough to pay sales tax (pulls data of POS unit) and other state taxes and then does made three weeks intense catch up of his books at tax time. I know he is not the only business owner who does this.

What are your arguments for why businesses need a dedicated bookkeeper and what has helped in convincing potential clients to realize they need help, or have all of your clients known they needed help and come to you?"
7,How to get status from engineering teams?,r/projectmanagement,swissarmychainsaw,24,29,https://www.reddit.com/r/projectmanagement/comments/1kivmwk/how_to_get_status_from_engineering_teams/,"What's a good way to get engineers to give project updates?  
I need something easy and light weight. I should say *Perceived* as easy.  
They feel like giving updates is just useless overhead.

PS - We just Jira...

Thanks

Edit: Going to add some more details here.

I'm fairly new to this team and what I see is there's a lot of tribalism, what I mean by that is you can only understand what's going on if you are talking to people directly, and all the time.    
Not all of the work is captured in milestones and stories (we're getting better).
  
Right now we have a meeting once a week to discuss ""sprint updates"" but it's this free form - go around the room and ramble about what you're working on, which does not scale and it makes doing status reports a friggin nightmare.

I'm trying to move them to a written update (255chars max) in a jira field. This will save time AND prevent 5 people from interviewing you when something goes wrong: See my Jira ticket on this issue.  
Which actually just happened to a team member yesterday.  
With a written update then you have time to have a conversation, which usually yields important information like ""oh yeah, I need help with this thing..."""
7,7 acres and smaller home vs larger home on .5 acres,r/RealEstate,ShotAirport9545,19,213,https://www.reddit.com/r/RealEstate/comments/1lsa8nj/7_acres_and_smaller_home_vs_larger_home_on_5_acres/,"Hello! We need help. My wife and I are currently in a situation where we are stuck between 2 homes as our potential forever or at least to raise kids. Home 1: 3 bed, 1.5 bath, 7 acres, secluded, 3 car garage, smaller rooms, large yard, surrounded by woods, small fish pond, large front screened in patio, nice stone back patio area, well water, septic tank, small deck on second floor, needs some upgrades, carpet, sink etc. nothing major. Home 2: .5 acres, 3bed, 2 full bath, tall ceiling, large home, neighborhood, small back yard, well kept, public water, sewer, limited parking, more interior space. We are pretty outdoorsy, both about the same price. Please help us think through this.

Edit: Both are 10-15 minutes from major shopping, doctors, restaurants. We are in our late 20’s outdoorsy hiking, fishing kayaking people. "
7,Urgent: First time dealing with bail so I need help bailing out a friend in Santa Ana,r/legal,HudyD,105,7,https://www.reddit.com/r/legal/comments/1lmyset/urgent_first_time_dealing_with_bail_so_i_need/,"Hey guys, I’m in over my head here. My best friend got arrested last night in Santa Ana (nothing violent, just a misdemeanor) and is sitting in Santa Ana Central Jail. His family is freaking out and I’ve never handled anything like this before.

I’ve been on the phone with a few bail bonds companies but I honestly don’t know who to trust. A lot of them gave me vague answers or weird fees. One company that stood out was [Future Bail Bonds](https://www.futurebailbonds.com/) and I liked that they answered right away and told me I could do the paperwork online without going back and forth to the jail.

I’m seriously overwhelmed and don’t want to make a bad call. Has anyone here actually worked with them? Cause I wanna know if all this good customer service translates to good legal work

LOCATION: California"
7,Credit card fraud? A furniture store opened a credit card without me there,r/legal,jadytw,37,21,https://www.reddit.com/r/legal/comments/1lh5k2o/credit_card_fraud_a_furniture_store_opened_a/,"So me and my mom went to a furniture store about 3 weeks ago and we financed some furniture under my name because we thought it would help my credit. The furniture store financed it with a company called Americas First Finance, they told me to call once the furniture was delivered to set up the payments. Well that same week we bought the furniture they started taking automated payments which I did not mind, but I still waited to call until after it was delivered. Keep in mind we only financed 1900 and I have a receipt saying it. Well the furniture was delivered Thursday and my mom did not like the couch, so she went back without me and asked to trade it for another one. The new one she wanted was 1000 more and the furniture store said to finance that amount. So she said okay, but she texted me to see what I think. I said to ask if it affects my credit and she said the worker said no. well the store financed it with a different company called synchrony and 5 minutes later I get a text and email that I have been approved for my new home credit card. I call my mother freaking out and she was apologizing because she did not know it was a credit card. They never told her, I texted her pictures and the worker kept saying it is not a credit card and that it’s only financing. Well this morning I called synchrony and they told me it is indeed a credit card. Going back to the original company we financed with, I called them this morning as well because the furniture store told me to call after it was delivered. I called and I was informed the amount that was financed was 2300 not 1900, I asked how that was possible and they told me to talk with the furniture store to resolve this problem. I’m not sure what to do now and seeking advice. Are they allowed to open a credit card like that without me there? And what do I do about the other financing since they are saying I owe more than I was originally told? I don’t blame my mom at all for this, she did not know it was a credit card, people have told me to file a police report but I don’t want to get her in trouble. I need help please, this is a furniture store in North Texas "
7,Non-profit status denied in Virginia and we already established a board of directors and have been operating for 6 months.,r/nonprofit,Remote-Camel6946,14,42,https://www.reddit.com/r/nonprofit/comments/1lphj44/nonprofit_status_denied_in_virginia_and_we/,"We were in the process of becoming an educational nonprofit and just found out our 501(c)(3) application was rejected. For the past six months, we have been actively running events. We have hosted over nine community-centered gatherings and they have gone really well. The turnout and feedback have been amazing.

But now we are in a tough spot. We have been making money from these events to cover costs, not for profit, and we are not yet a registered nonprofit or LLC. We are operating in Virginia, but without full legal structure, and it is starting to show.

Our board has grown frustrated. They are unpaid volunteers and I understand where they are coming from. It has been a lot of work and we are still not officially established. Some are even saying we have not held enough educational events, even though we intentionally include education in everything we do. There are also whispers about trying to vote out the founding team and take over the organization. That has been deeply painful. I have put in everything to get this off the ground and I was not expecting that kind of shift so early.

**Here is where I need help:**

1. What can we do after getting our nonprofit status denied? Can we reapply or restructure to improve our application?
2. Our events have generated money mostly to cover costs. Are we at legal risk for doing this without nonprofit status?
3. We are not an LLC or nonprofit, just registered to operate in Virginia. I am worried about liability and responsibility. I do not want to be personally liable.
4. The team dynamic has changed. Some people seem to be working behind our backs trying to push the founder out of the board so they can take over, and while I know the mission should come first, I also feel really disheartened. I have given everything and I still believe in what we are building. It's only been 6 months and I a m not done finding the organziation.

I want to keep going and do things the right way. We have created something beautiful that truly serves the community. But I am overwhelmed and honestly a little scared.

Has anyone been through something like this? Any advice or support would really mean a lot right now."
7,Not getting hits on my resume - need help,r/Accounting,Tuffbacon,18,52,https://www.reddit.com/r/Accounting/comments/1lsrizs/not_getting_hits_on_my_resume_need_help/,"Hi,

As you can see by my title I am not having much luck after job searching for about 3 months. I am an Office Manager at a senior living community looking to go into the accounting field. I changed mg title and adjust to focus on my accounting related tasks I do. I want to go towards something more to what I went to college for. Can anybody offer any advice to spruce up my resume and get an interview?"
7,Best CRM for donor management,r/CRM,Silly_Employment8211,11,24,https://www.reddit.com/r/CRM/comments/1jvnprd/best_crm_for_donor_management/,"As the title suggests, I need help identifying the best CRM for donor management. This nonprofit isn’t huge as it’s just in one city. It however is very involved in the community and we need a better system to manage our donor list. To get other folks’ buy in I am hoping to keep the price at a minimum with maybe the option to upgrade as needed. At this time, we have a pretty robust shared google drive so I don’t anticipate we would be using it for anything like that. I also do not have experience using a CRM other than excel, so I would like a software that is user friendly or has easy to follow tutorials. I am willing to put in the work. I just need it to feel approachable. 

Thank you in advanced for your recommendations!"
7,I was “homeschooled” and I need help building my education.,r/education,CandyNecklacesLanita,16,37,https://www.reddit.com/r/education/comments/1knq5e1/i_was_homeschooled_and_i_need_help_building_my/,"I was homeschooled from 2nd-8th grade. During those years I was educationally neglected. Even though I went to public school during my high school years I don’t really recall much. 

I am pretty smart I would say, I am pursuing two degrees right now and have been keeping a B average which I think is great considering the circumstances. But I still don’t know how to do multiplication or even add large numbers together which is embarrassing. I want to be an informed adult and I know it’s my responsibility to teach myself the things I’ve missed.

I know I need to catch up on math, english, science, social studies, and I may be missing some things. If you have ideas of where to start or what I need to know please help!  "
